[
  {
    "team_id": "algeria",
    "team_name": "Algeria",
    "source": "/home/runner/work/football-data-platform/football-data-platform/data/predictor-assets/files/processed/normalized_matches.csv",
    "source_status": "missing_source",
    "match_count": 0,
    "latest_match_date": null,
    "form_summary": {
      "played": 0,
      "won": 0,
      "drawn": 0,
      "lost": 0,
      "goals_for": 0,
      "goals_against": 0,
      "goal_difference": 0
    },
    "matches": [],
    "updated_at": "2026-05-17T00:00:00Z"
  },
  {
    "team_id": "argentina",
    "team_name": "Argentina",
    "source": "/home/runner/work/football-data-platform/football-data-platform/data/predictor-assets/files/processed/normalized_matches.csv",
    "source_status": "missing_source",
    "match_count": 0,
    "latest_match_date": null,
    "form_summary": {
      "played": 0,
      "won": 0,
      "drawn": 0,
      "lost": 0,
      "goals_for": 0,
      "goals_against": 0,
      "goal_difference": 0
    },
    "matches": [],
    "updated_at": "2026-05-17T00:00:00Z"
  },
  {
    "team_id": "australia",
    "team_name": "Australia",
    "source": "/home/runner/work/football-data-platform/football-data-platform/data/predictor-assets/files/processed/normalized_matches.csv",
    "source_status": "missing_source",
    "match_count": 0,
    "latest_match_date": null,
    "form_summary": {
      "played": 0,
      "won": 0,
      "drawn": 0,
      "lost": 0,
      "goals_for": 0,
      "goals_against": 0,
      "goal_difference": 0
    },
    "matches": [],
    "updated_at": "2026-05-17T00:00:00Z"
  },
  {
    "team_id": "austria",
    "team_name": "Austria",
    "source": "/home/runner/work/football-data-platform/football-data-platform/data/predictor-assets/files/processed/normalized_matches.csv",
    "source_status": "missing_source",
    "match_count": 0,
    "latest_match_date": null,
    "form_summary": {
      "played": 0,
      "won": 0,
      "drawn": 0,
      "lost": 0,
      "goals_for": 0,
      "goals_against": 0,
      "goal_difference": 0
    },
    "matches": [],
    "updated_at": "2026-05-17T00:00:00Z"
  },
  {
    "team_id": "belgium",
    "team_name": "Belgium",
    "source": "/home/runner/work/football-data-platform/football-data-platform/data/predictor-assets/files/processed/normalized_matches.csv",
    "source_status": "missing_source",
    "match_count": 0,
    "latest_match_date": null,
    "form_summary": {
      "played": 0,
      "won": 0,
      "drawn": 0,
      "lost": 0,
      "goals_for": 0,
      "goals_against": 0,
      "goal_difference": 0
    },
    "matches": [],
    "updated_at": "2026-05-17T00:00:00Z"
  },
  {
    "team_id": "bosnia-and-herzegovina",
    "team_name": "Bosnia and Herzegovina",
    "source": "/home/runner/work/football-data-platform/football-data-platform/data/predictor-assets/files/processed/normalized_matches.csv",
    "source_status": "missing_source",
    "match_count": 0,
    "latest_match_date": null,
    "form_summary": {
      "played": 0,
      "won": 0,
      "drawn": 0,
      "lost": 0,
      "goals_for": 0,
      "goals_against": 0,
      "goal_difference": 0
    },
    "matches": [],
    "updated_at": "2026-05-17T00:00:00Z"
  },
  {
    "team_id": "brazil",
    "team_name": "Brazil",
    "source": "/home/runner/work/football-data-platform/football-data-platform/data/predictor-assets/files/processed/normalized_matches.csv",
    "source_status": "missing_source",
    "match_count": 0,
    "latest_match_date": null,
    "form_summary": {
      "played": 0,
      "won": 0,
      "drawn": 0,
      "lost": 0,
      "goals_for": 0,
      "goals_against": 0,
      "goal_difference": 0
    },
    "matches": [],
    "updated_at": "2026-05-17T00:00:00Z"
  },
  {
    "team_id": "cabo-verde",
    "team_name": "Cabo Verde",
    "source": "/home/runner/work/football-data-platform/football-data-platform/data/predictor-assets/files/processed/normalized_matches.csv",
    "source_status": "missing_source",
    "match_count": 0,
    "latest_match_date": null,
    "form_summary": {
      "played": 0,
      "won": 0,
      "drawn": 0,
      "lost": 0,
      "goals_for": 0,
      "goals_against": 0,
      "goal_difference": 0
    },
    "matches": [],
    "updated_at": "2026-05-17T00:00:00Z"
  },
  {
    "team_id": "canada",
    "team_name": "Canada",
    "source": "/home/runner/work/football-data-platform/football-data-platform/data/predictor-assets/files/processed/normalized_matches.csv",
    "source_status": "missing_source",
    "match_count": 0,
    "latest_match_date": null,
    "form_summary": {
      "played": 0,
      "won": 0,
      "drawn": 0,
      "lost": 0,
      "goals_for": 0,
      "goals_against": 0,
      "goal_difference": 0
    },
    "matches": [],
    "updated_at": "2026-05-17T00:00:00Z"
  },
  {
    "team_id": "colombia",
    "team_name": "Colombia",
    "source": "/home/runner/work/football-data-platform/football-data-platform/data/predictor-assets/files/processed/normalized_matches.csv",
    "source_status": "missing_source",
    "match_count": 0,
    "latest_match_date": null,
    "form_summary": {
      "played": 0,
      "won": 0,
      "drawn": 0,
      "lost": 0,
      "goals_for": 0,
      "goals_against": 0,
      "goal_difference": 0
    },
    "matches": [],
    "updated_at": "2026-05-17T00:00:00Z"
  },
  {
    "team_id": "congo-dr",
    "team_name": "Congo DR",
    "source": "/home/runner/work/football-data-platform/football-data-platform/data/predictor-assets/files/processed/normalized_matches.csv",
    "source_status": "missing_source",
    "match_count": 0,
    "latest_match_date": null,
    "form_summary": {
      "played": 0,
      "won": 0,
      "drawn": 0,
      "lost": 0,
      "goals_for": 0,
      "goals_against": 0,
      "goal_difference": 0
    },
    "matches": [],
    "updated_at": "2026-05-17T00:00:00Z"
  },
  {
    "team_id": "cote-divoire",
    "team_name": "Cote d'Ivoire",
    "source": "/home/runner/work/football-data-platform/football-data-platform/data/predictor-assets/files/processed/normalized_matches.csv",
    "source_status": "missing_source",
    "match_count": 0,
    "latest_match_date": null,
    "form_summary": {
      "played": 0,
      "won": 0,
      "drawn": 0,
      "lost": 0,
      "goals_for": 0,
      "goals_against": 0,
      "goal_difference": 0
    },
    "matches": [],
    "updated_at": "2026-05-17T00:00:00Z"
  },
  {
    "team_id": "croatia",
    "team_name": "Croatia",
    "source": "/home/runner/work/football-data-platform/football-data-platform/data/predictor-assets/files/processed/normalized_matches.csv",
    "source_status": "missing_source",
    "match_count": 0,
    "latest_match_date": null,
    "form_summary": {
      "played": 0,
      "won": 0,
      "drawn": 0,
      "lost": 0,
      "goals_for": 0,
      "goals_against": 0,
      "goal_difference": 0
    },
    "matches": [],
    "updated_at": "2026-05-17T00:00:00Z"
  },
  {
    "team_id": "curacao",
    "team_name": "Curacao",
    "source": "/home/runner/work/football-data-platform/football-data-platform/data/predictor-assets/files/processed/normalized_matches.csv",
    "source_status": "missing_source",
    "match_count": 0,
    "latest_match_date": null,
    "form_summary": {
      "played": 0,
      "won": 0,
      "drawn": 0,
      "lost": 0,
      "goals_for": 0,
      "goals_against": 0,
      "goal_difference": 0
    },
    "matches": [],
    "updated_at": "2026-05-17T00:00:00Z"
  },
  {
    "team_id": "czechia",
    "team_name": "Czechia",
    "source": "/home/runner/work/football-data-platform/football-data-platform/data/predictor-assets/files/processed/normalized_matches.csv",
    "source_status": "missing_source",
    "match_count": 0,
    "latest_match_date": null,
    "form_summary": {
      "played": 0,
      "won": 0,
      "drawn": 0,
      "lost": 0,
      "goals_for": 0,
      "goals_against": 0,
      "goal_difference": 0
    },
    "matches": [],
    "updated_at": "2026-05-17T00:00:00Z"
  },
  {
    "team_id": "ecuador",
    "team_name": "Ecuador",
    "source": "/home/runner/work/football-data-platform/football-data-platform/data/predictor-assets/files/processed/normalized_matches.csv",
    "source_status": "missing_source",
    "match_count": 0,
    "latest_match_date": null,
    "form_summary": {
      "played": 0,
      "won": 0,
      "drawn": 0,
      "lost": 0,
      "goals_for": 0,
      "goals_against": 0,
      "goal_difference": 0
    },
    "matches": [],
    "updated_at": "2026-05-17T00:00:00Z"
  },
  {
    "team_id": "egypt",
    "team_name": "Egypt",
    "source": "/home/runner/work/football-data-platform/football-data-platform/data/predictor-assets/files/processed/normalized_matches.csv",
    "source_status": "missing_source",
    "match_count": 0,
    "latest_match_date": null,
    "form_summary": {
      "played": 0,
      "won": 0,
      "drawn": 0,
      "lost": 0,
      "goals_for": 0,
      "goals_against": 0,
      "goal_difference": 0
    },
    "matches": [],
    "updated_at": "2026-05-17T00:00:00Z"
  },
  {
    "team_id": "england",
    "team_name": "England",
    "source": "/home/runner/work/football-data-platform/football-data-platform/data/predictor-assets/files/processed/normalized_matches.csv",
    "source_status": "missing_source",
    "match_count": 0,
    "latest_match_date": null,
    "form_summary": {
      "played": 0,
      "won": 0,
      "drawn": 0,
      "lost": 0,
      "goals_for": 0,
      "goals_against": 0,
      "goal_difference": 0
    },
    "matches": [],
    "updated_at": "2026-05-17T00:00:00Z"
  },
  {
    "team_id": "france",
    "team_name": "France",
    "source": "/home/runner/work/football-data-platform/football-data-platform/data/predictor-assets/files/processed/normalized_matches.csv",
    "source_status": "missing_source",
    "match_count": 0,
    "latest_match_date": null,
    "form_summary": {
      "played": 0,
      "won": 0,
      "drawn": 0,
      "lost": 0,